{
  "schema_version": "1.0.0",
  "context": {
    "workspace_id": "ws-demo",
    "session_id": "session-demo",
    "run_id": "run-demo",
    "document_id": "fs-demo",
    "base_document_version": "dv-7",
    "context_snapshot_id": "ctx-7",
    "template_id": "traditional-abap-five",
    "template_version": "1.0.0"
  },
  "id": "approval-1",
  "document_version_id": "dv-7",
  "document_hash": "fixture-hash-dv7",
  "review_ids": [
    "review-1"
  ],
  "evidence_manifest_hash": "fixture-evidence-hash",
  "policy_version": "1.0.0",
  "actor_id": "approver-demo",
  "actor_role": "business_approver",
  "action": "reject",
  "reason": "技术证据缺失",
  "created_at": "2026-10-03T08:00:00Z"
}
